Match_ID,Event,Year,Date,Team 1,Team 2,Match Format,Maps Picked/Banned,Score per Map,Score per Half,Sides Chosen by Non-Picker
1,Champions Tour 2023: LOCK//IN São Paulo,2023,2023-02-13 12:10:00,KOI,NRG Esports,Bo3,NRG ban Ascent; KOI ban Split; NRG pick Icebox; KOI pick Haven; NRG ban Fracture; KOI ban Lotus; Pearl remains,Icebox: 11-13; Haven: 9-13,"Team 1: 9 / 2, Team 2: 3 / 10; Team 1: 5 / 4, Team 2: 5 / 8",Team 1: Attack; Team 2: Attack
2,Champions Tour 2023: LOCK//IN São Paulo,2023,2023-02-13 15:05:00,DetonatioN FocusMe,GIANTX,Bo3,DFM ban Split; GIA ban Fracture; DFM pick Haven; GIA pick Icebox; DFM ban Lotus; GIA ban Ascent; Pearl remains,Haven: 4-13; Icebox: 7-13,"Team 1: 4 / 0, Team 2: 8 / 5; Team 1: 3 / 4, Team 2: 5 / 8",Team 2: Defense; Team 1: Defense
3,Champions Tour 2023: LOCK//IN São Paulo,2023,2023-02-14 12:10:00,FunPlus Phoenix,Karmine Corp,Bo3,FPX ban Icebox; KC ban Ascent; FPX pick Lotus; KC pick Haven; FPX ban Split; KC ban Fracture; Pearl remains,Lotus: 6-13; Haven: 13-8; Pearl: 6-13,"Team 1: 4 / 2, Team 2: 8 / 5; Team 1: 7 / 6, Team 2: 2 / 6; Team 1: 1 / 5, Team 2: 6 / 7",Team 2: Defense; Team 1: Defense
4,Champions Tour 2023: LOCK//IN São Paulo,2023,2023-02-14 15:45:00,BBL Esports,DRX,Bo3,DRX ban Lotus; BBL ban Fracture; DRX pick Pearl; BBL pick Ascent; DRX ban Split; BBL ban Icebox; Haven remains,Pearl: 3-13; Ascent: 13-11; Haven: 7-13,"Team 1: 0 / 3, Team 2: 4 / 9; Team 1: 4 / 9, Team 2: 8 / 3; Team 1: 6 / 1, Team 2: 2 / 11",Team 1: Defense; Team 2: Defense
5,Champions Tour 2023: LOCK//IN São Paulo,2023,2023-02-14 19:05:00,Cloud9,Paper Rex,Bo3,PRX ban Icebox; C9 ban Ascent; PRX pick Lotus; C9 pick Pearl; PRX ban Split; C9 ban Haven; Fracture remains,Lotus: 13-8; Pearl: 13-4,"Team 1: 6 / 7, Team 2: 3 / 5; Team 1: 10 / 3, Team 2: 2 / 2",Team 1: Defense; Team 2: Defense
6,Champions Tour 2023: LOCK//IN São Paulo,2023,2023-02-15 12:00:00,Team Heretics,Evil Geniuses,Bo3,EG ban Lotus; TH ban Icebox; EG pick Pearl; TH pick Ascent; EG ban Fracture; TH ban Split; Haven remains,Pearl: 8-13; Ascent: 8-13,"Team 1: 2 / 6, Team 2: 7 / 6; Team 1: 5 / 3, Team 2: 7 / 6",Team 1: Defense; Team 2: Defense
7,Champions Tour 2023: LOCK//IN São Paulo,2023,2023-02-15 14:35:00,MIBR,Talon Esports,Bo3,MIBR ban Ascent; TLN ban Lotus; MIBR pick Haven; TLN pick Fracture; MIBR ban Split; TLN ban Pearl; Icebox remains,Haven: 8-13; Fracture: 11-13,"Team 1: 4 / 4, Team 2: 8 / 5; Team 1: 5 / 6, Team 2: 7 / 6",Team 2: Defense; Team 1: Attack
8,Champions Tour 2023: LOCK//IN São Paulo,2023,2023-02-15 17:20:00,Gen.G,LOUD,Bo3,LOUD ban Haven; GEN ban Icebox; LOUD pick Pearl; GEN pick Fracture; LOUD ban Lotus; GEN ban Ascent; Split remains,Pearl: 9-13; Fracture: 12-14,"Team 1: 7 / 2, Team 2: 5 / 8; Team 1: 8 / 4 / 0, Team 2: 4 / 8 / 2",Team 1: Attack; Team 2: Attack
9,Champions Tour 2023: LOCK//IN São Paulo,2023,2023-02-17 12:05:00,NRG Esports,GIANTX,Bo3,NRG ban Ascent; GIA ban Fracture; NRG pick Lotus; GIA pick Haven; NRG ban Pearl; GIA ban Split; Icebox remains,Lotus: 12-14; Haven: 13-1; Icebox: 13-7,"Team 1: 8 / 4 / 0, Team 2: 4 / 8 / 2; Team 1: 11 / 2, Team 2: 1 / 0; Team 1: 4 / 9, Team 2: 4 / 3",Team 2: Attack; Team 1: Attack
10,Champions Tour 2023: LOCK//IN São Paulo,2023,2023-02-17 15:35:00,LOUD,Karmine Corp,Bo3,LOUD ban Icebox; KC ban Ascent; LOUD pick Pearl; KC pick Split; LOUD ban Lotus; KC ban Haven; Fracture remains,Pearl: 13-10; Split: 13-8,"Team 1: 8 / 5, Team 2: 4 / 6; Team 1: 8 / 5, Team 2: 4 / 4",Team 2: Defense; Team 1: Attack
11,Champions Tour 2023: LOCK//IN São Paulo,2023,2023-02-18 12:05:00,DRX,Cloud9,Bo3,C9 ban Fracture; DRX ban Lotus; C9 pick Pearl; DRX pick Haven; C9 ban Ascent; DRX ban Split; Icebox remains,Pearl: 3-13; Haven: 13-7; Icebox: 13-2,"Team 1: 3 / 0, Team 2: 9 / 4; Team 1: 9 / 4, Team 2: 3 / 4; Team 1: 11 / 2, Team 2: 1 / 1",Team 1: Attack; Team 2: Defense
12,Champions Tour 2023: LOCK//IN São Paulo,2023,2023-02-18 15:00:00,Evil Geniuses,Talon Esports,Bo3,EG ban Lotus; TLN ban Pearl; EG pick Haven; TLN pick Split; EG ban Ascent; TLN ban Fracture; Icebox remains,Haven: 11-13; Split: 10-13,"Team 1: 2 / 9, Team 2: 10 / 3; Team 1: 2 / 8, Team 2: 9 / 4",Team 2: Attack; Team 1: Defense
13,Champions Tour 2023: LOCK//IN São Paulo,2023,2023-02-19 12:05:00,NRG Esports,LOUD,Bo3,NRG ban Ascent; LOUD ban Haven; NRG pick Split; LOUD pick Pearl; NRG ban Icebox; LOUD ban Lotus; Fracture remains,Split: 3-13; Pearl: 15-13; Fracture: 16-18,"Team 1: 0 / 3, Team 2: 4 / 9; Team 1: 7 / 5 / 3, Team 2: 5 / 7 / 1; Team 1: 7 / 5 / 4, Team 2: 5 / 7 / 6",Team 2: Attack; Team 1: Attack
14,Champions Tour 2023: LOCK//IN São Paulo,2023,2023-02-19 16:00:00,DRX,Talon Esports,Bo3,TLN ban Haven; DRX ban Lotus; TLN pick Fracture; DRX pick Ascent; TLN ban Split; DRX ban Pearl; Icebox remains,Fracture: 10-13; Ascent: 13-6; Icebox: 13-10,"Team 1: 4 / 6, Team 2: 8 / 5; Team 1: 6 / 7, Team 2: 6 / 0; Team 1: 7 / 6, Team 2: 5 / 5",Team 1: Attack; Team 2: Defense
15,Champions Tour 2023: LOCK//IN São Paulo,2023,2023-02-22 12:00:00,Team Liquid,Team Secret,Bo3,TS ban Ascent; TL ban Haven; TS pick Icebox; TL pick Fracture; TS ban Pearl; TL ban Split; Lotus remains,Icebox: 8-13; Fracture: 7-13,"Team 1: 2 / 6, Team 2: 10 / 3; Team 1: 3 / 4, Team 2: 9 / 4",Team 1: Attack; Team 2: Defense
16,Champions Tour 2023: LOCK//IN São Paulo,2023,2023-02-22 14:30:00,Natus Vincere,KRÜ Esports,Bo3,KRÜ ban Icebox; NAVI ban Haven; KRÜ pick Ascent; NAVI pick Lotus; KRÜ ban Fracture; NAVI ban Split; Pearl remains,Ascent: 13-5; Lotus: 13-10,"Team 1: 9 / 4, Team 2: 3 / 2; Team 1: 10 / 3, Team 2: 1 / 9",Team 1: Attack; Team 2: Attack
17,Champions Tour 2023: LOCK//IN São Paulo,2023,2023-02-22 17:00:00,ZETA DIVISION,LEVIATÁN,Bo3,LEV ban Split; ZETA ban Icebox; LEV pick Ascent; ZETA pick Pearl; LEV ban Fracture; ZETA ban Lotus; Haven remains,Ascent: 4-13; Pearl: 11-13,"Team 1: 2 / 2, Team 2: 3 / 10; Team 1: 6 / 5, Team 2: 6 / 7",Team 1: Defense; Team 2: Defense
18,Champions Tour 2023: LOCK//IN São Paulo,2023,2023-02-23 12:05:00,Team Vitality,Global Esports,Bo3,GE ban Ascent; VIT ban Icebox; GE pick Split; VIT pick Pearl; GE ban Haven; VIT ban Fracture; Lotus remains,Split: 13-4; Pearl: 9-13; Lotus: 13-6,"Team 1: 9 / 4, Team 2: 3 / 1; Team 1: 2 / 7, Team 2: 8 / 5; Team 1: 8 / 5, Team 2: 4 / 2",Team 1: Attack; Team 2: Attack
19,Champions Tour 2023: LOCK//IN São Paulo,2023,2023-02-23 15:10:00,FUT Esports,Rex Regum Qeon,Bo3,RRQ ban Fracture; FUT ban Haven; RRQ pick Lotus; FUT pick Pearl; RRQ ban Icebox; FUT ban Ascent; Split remains,Lotus: 13-3; Pearl: 13-11,"Team 1: 3 / 10, Team 2: 1 / 2; Team 1: 8 / 5, Team 2: 4 / 7",Team 1: Defense; Team 2: Attack
20,Champions Tour 2023: LOCK//IN São Paulo,2023,2023-02-23 17:30:00,100 Thieves,EDward Gaming,Bo3,100T ban Ascent; EDG ban Haven; 100T pick Icebox; EDG pick Lotus; 100T ban Split; EDG ban Fracture; Pearl remains,Icebox: 13-10; Lotus: 9-13; Pearl: 14-12,"Team 1: 5 / 8, Team 2: 6 / 4; Team 1: 7 / 2, Team 2: 5 / 8; Team 1: 5 / 7 / 2, Team 2: 7 / 5 / 0",Team 2: Attack; Team 1: Attack
21,Champions Tour 2023: LOCK//IN São Paulo,2023,2023-02-24 12:05:00,Sentinels,FNATIC,Bo3,FNC ban Pearl; SEN ban Icebox; FNC pick Haven; SEN pick Split; FNC ban Ascent; SEN ban Fracture; Lotus remains,Haven: 6-13; Split: 7-13,"Team 1: 3 / 3, Team 2: 9 / 4; Team 1: 6 / 1, Team 2: 6 / 7",Team 1: Attack; Team 2: Defense
22,Champions Tour 2023: LOCK//IN São Paulo,2023,2023-02-24 14:50:00,T1,FURIA,Bo3,T1 ban Ascent; FUR ban Lotus; T1 pick Pearl; FUR pick Icebox; T1 ban Split; FUR ban Haven; Fracture remains,Pearl: 7-13; Icebox: 5-13,"Team 1: 1 / 6, Team 2: 7 / 6; Team 1: 5 / 0, Team 2: 7 / 6",Team 2: Attack; Team 1: Attack
23,Champions Tour 2023: LOCK//IN São Paulo,2023,2023-02-25 12:00:00,Team Secret,Natus Vincere,Bo3,TS ban Ascent; NAVI ban Haven; TS pick Icebox; NAVI pick Pearl; TS ban Lotus; NAVI ban Split; Fracture remains,Icebox: 8-13; Pearl: 4-13,"Team 1: 6 / 2, Team 2: 6 / 7; Team 1: 3 / 1, Team 2: 9 / 4",Team 2: Defense; Team 1: Attack
24,Champions Tour 2023: LOCK//IN São Paulo,2023,2023-02-25 14:30:00,LEVIATÁN,Team Vitality,Bo3,LEV ban Split; VIT ban Icebox; LEV pick Haven; VIT pick Pearl; LEV ban Fracture; VIT ban Lotus; Ascent remains,Haven: 16-14; Pearl: 13-3,"Team 1: 7 / 5 / 4, Team 2: 5 / 7 / 2; Team 1: 3 / 10, Team 2: 1 / 2",Team 2: Attack; Team 1: Defense
25,Champions Tour 2023: LOCK//IN São Paulo,2023,2023-02-26 12:00:00,FUT Esports,100 Thieves,Bo3,FUT ban Fracture; 100T ban Ascent; FUT pick Lotus; 100T pick Haven; FUT ban Pearl; 100T ban Split; Icebox remains,Lotus: 13-9; Haven: 11-13; Icebox: 8-13,"Team 1: 8 / 5, Team 2: 2 / 7; Team 1: 6 / 5, Team 2: 6 / 7; Team 1: 4 / 4, Team 2: 8 / 5",Team 2: Attack; Team 1: Defense
26,Champions Tour 2023: LOCK//IN São Paulo,2023,2023-02-26 15:35:00,FNATIC,FURIA,Bo3,FNC ban Pearl; FUR ban Lotus; FNC pick Haven; FUR pick Ascent; FNC ban Split; FUR ban Fracture; Icebox remains,Haven: 18-16; Ascent: 13-9,"Team 1: 8 / 4 / 6, Team 2: 4 / 8 / 4; Team 1: 5 / 8, Team 2: 5 / 4",Team 2: Defense; Team 1: Defense
27,Champions Tour 2023: LOCK//IN São Paulo,2023,2023-02-27 12:00:00,Natus Vincere,LEVIATÁN,Bo3,LEV ban Split; NAVI ban Haven; LEV pick Ascent; NAVI pick Fracture; LEV ban Lotus; NAVI ban Icebox; Pearl remains,Ascent: 13-10; Fracture: 13-2,"Team 1: 7 / 6, Team 2: 4 / 6; Team 1: 11 / 2, Team 2: 1 / 1",Team 1: Defense; Team 2: Defense
28,Champions Tour 2023: LOCK//IN São Paulo,2023,2023-02-27 14:25:00,100 Thieves,FNATIC,Bo3,100T ban Ascent; FNC ban Pearl; 100T pick Fracture; FNC pick Icebox; 100T ban Split; FNC ban Haven; Lotus remains,Fracture: 1-13; Icebox: 10-13,"Team 1: 0 / 1, Team 2: 2 / 11; Team 1: 2 / 8, Team 2: 10 / 3",Team 2: Attack; Team 1: Attack
29,Champions Tour 2023: LOCK//IN São Paulo,2023,2023-03-02 12:00:00,LOUD,DRX,Bo5,LOUD ban Haven; DRX ban Lotus; LOUD pick Pearl; DRX pick Icebox; LOUD pick Split; DRX pick Fracture; Ascent remains,Pearl: 13-5; Icebox: 13-8; Split: 7-13; Fracture: 7-13; Ascent: 13-8,"Team 1: 4 / 9, Team 2: 2 / 3; Team 1: 9 / 4, Team 2: 3 / 5; Team 1: 3 / 4, Team 2: 9 / 4; Team 1: 6 / 1, Team 2: 6 / 7; Team 1: 7 / 6, Team 2: 5 / 3",Team 2: Attack; Team 1: Attack; Team 2: Defense; Team 1: Attack
30,Champions Tour 2023: LOCK//IN São Paulo,2023,2023-03-03 12:00:00,Natus Vincere,FNATIC,Bo5,FNC ban Pearl; NAVI ban Icebox; FNC pick Haven; NAVI pick Lotus; FNC pick Fracture; NAVI pick Split; Ascent remains,Haven: 11-13; Lotus: 4-13; Fracture: 11-13,"Team 1: 5 / 6, Team 2: 7 / 6; Team 1: 2 / 2, Team 2: 3 / 10; Team 1: 5 / 6, Team 2: 7 / 6",Team 1: Attack; Team 2: Attack; Team 1: Defense
31,Champions Tour 2023: LOCK//IN São Paulo,2023,2023-03-04 13:30:00,LOUD,FNATIC,Bo5,LOUD ban Haven; FNC ban Pearl; LOUD pick Ascent; FNC pick Fracture; LOUD pick Split; FNC pick Lotus; Icebox remains,Ascent: 8-13; Fracture: 7-13; Split: 13-9; Lotus: 13-8; Icebox: 12-14,"Team 1: 4 / 4, Team 2: 8 / 5; Team 1: 1 / 6, Team 2: 7 / 6; Team 1: 7 / 6, Team 2: 5 / 4; Team 1: 7 / 6, Team 2: 5 / 3; Team 1: 9 / 3 / 0, Team 2: 3 / 9 / 2",Team 2: Defense; Team 1: Defense; Team 2: Defense; Team 1: Attack
32,Champions Tour 2023: Pacific League,2023,2023-03-25 05:00:00,ZETA DIVISION,DRX,Bo3,DRX ban Lotus; ZETA ban Fracture; DRX pick Ascent; ZETA pick Pearl; DRX ban Split; ZETA ban Icebox; Haven remains,Ascent: 5-13; Pearl: 5-13,"Team 1: 1 / 4, Team 2: 5 / 8; Team 1: 4 / 1, Team 2: 2 / 11",Team 1: Defense; Team 2: Attack
33,Champions Tour 2023: Pacific League,2023,2023-03-25 08:00:00,T1,Global Esports,Bo3,GE ban Fracture; T1 ban Split; GE pick Pearl; T1 pick Haven; GE ban Ascent; T1 ban Icebox; Lotus remains,Pearl: 13-8; Haven: 4-13; Lotus: 13-7,"Team 1: 4 / 9, Team 2: 5 / 3; Team 1: 2 / 2, Team 2: 3 / 10; Team 1: 5 / 8, Team 2: 3 / 4",Team 1: Defense; Team 2: Attack
34,Champions Tour 2023: Pacific League,2023,2023-03-26 05:00:00,Paper Rex,DetonatioN FocusMe,Bo3,PRX ban Icebox; DFM ban Ascent; PRX pick Pearl; DFM pick Lotus; PRX ban Haven; DFM ban Split; Fracture remains,Pearl: 13-5; Lotus: 13-11,"Team 1: 4 / 9, Team 2: 2 / 3; Team 1: 7 / 6, Team 2: 5 / 6",Team 2: Attack; Team 1: Attack
35,Champions Tour 2023: Pacific League,2023,2023-03-26 08:00:00,Team Secret,Talon Esports,Bo3,TLN ban Haven; TS ban Pearl; TLN pick Ascent; TS pick Icebox; TLN ban Split; TS ban Lotus; Fracture remains,Ascent: 13-5; Icebox: 8-13; Fracture: 13-3,"Team 1: 5 / 8, Team 2: 1 / 4; Team 1: 3 / 5, Team 2: 9 / 4; Team 1: 10 / 3, Team 2: 2 / 1",Team 1: Defense; Team 2: Defense
36,Champions Tour 2023: Pacific League,2023,2023-03-27 05:00:00,Rex Regum Qeon,Gen.G,Bo3,GEN ban Icebox; RRQ ban Split; GEN pick Fracture; RRQ pick Lotus; GEN ban Ascent; RRQ ban Pearl; Haven remains,Fracture: 9-13; Lotus: 6-13,"Team 1: 5 / 4, Team 2: 5 / 8; Team 1: 2 / 4, Team 2: 5 / 8",Team 1: Defense; Team 2: Attack
37,Champions Tour 2023: Pacific League,2023,2023-04-01 05:00:00,ZETA DIVISION,Rex Regum Qeon,Bo3,ZETA ban Fracture; RRQ ban Pearl; ZETA pick Haven; RRQ pick Ascent; ZETA ban Icebox; RRQ ban Split; Lotus remains,Haven: 10-13; Ascent: 13-10; Lotus: 13-5,"Team 1: 3 / 7, Team 2: 9 / 4; Team 1: 6 / 7, Team 2: 6 / 4; Team 1: 7 / 6, Team 2: 5 / 0",Team 2: Defense; Team 1: Attack
38,Champions Tour 2023: Pacific League,2023,2023-04-01 08:30:00,Talon Esports,T1,Bo3,T1 ban Split; TLN ban Pearl; T1 pick Ascent; TLN pick Haven; T1 ban Icebox; TLN ban Fracture; Lotus remains,Ascent: 8-13; Haven: 6-13,"Team 1: 4 / 4, Team 2: 5 / 8; Team 1: 3 / 3, Team 2: 4 / 9",Team 1: Defense; Team 2: Attack
39,Champions Tour 2023: Pacific League,2023,2023-04-02 05:00:00,Team Secret,Paper Rex,Bo3,TS ban Pearl; PRX ban Icebox; TS pick Haven; PRX pick Fracture; TS ban Ascent; PRX ban Lotus; Split remains,Haven: 11-13; Fracture: 13-11; Split: 13-10,"Team 1: 5 / 6, Team 2: 7 / 6; Team 1: 5 / 8, Team 2: 7 / 4; Team 1: 8 / 5, Team 2: 3 / 7",Team 2: Attack; Team 1: Defense
40,Champions Tour 2023: Pacific League,2023,2023-04-02 08:30:00,Gen.G,DetonatioN FocusMe,Bo3,DFM ban Icebox; GEN ban Split; DFM pick Lotus; GEN pick Fracture; DFM ban Ascent; GEN ban Haven; Pearl remains,Lotus: 13-8; Fracture: 4-13; Pearl: 13-8,"Team 1: 5 / 8, Team 2: 7 / 1; Team 1: 0 / 4, Team 2: 5 / 8; Team 1: 8 / 5, Team 2: 1 / 7",Team 1: Attack; Team 2: Attack
41,Champions Tour 2023: Pacific League,2023,2023-04-03 05:00:00,Global Esports,DRX,Bo3,DRX ban Lotus; GE ban Ascent; DRX pick Haven; GE pick Split; DRX ban Fracture; GE ban Icebox; Pearl remains,Haven: 11-13; Split: 15-17,"Team 1: 5 / 6, Team 2: 7 / 6; Team 1: 6 / 6 / 3, Team 2: 6 / 6 / 5",Team 1: Attack; Team 2: Defense
42,Champions Tour 2023: Pacific League,2023,2023-04-08 05:00:00,Rex Regum Qeon,DetonatioN FocusMe,Bo3,RRQ ban Lotus; DFM ban Icebox; RRQ pick Haven; DFM pick Pearl; RRQ ban Fracture; DFM ban Split; Ascent remains,Haven: 13-4; Pearl: 13-7,"Team 1: 3 / 10, Team 2: 2 / 2; Team 1: 4 / 9, Team 2: 4 / 3",Team 2: Attack; Team 1: Defense
43,Champions Tour 2023: Pacific League,2023,2023-04-08 07:10:00,T1,Paper Rex,Bo3,T1 ban Icebox; PRX ban Haven; T1 pick Pearl; PRX pick Fracture; T1 ban Ascent; PRX ban Split; Lotus remains,Pearl: 3-13; Fracture: 6-13,"Team 1: 2 / 1, Team 2: 2 / 11; Team 1: 1 / 5, Team 2: 6 / 7",Team 2: Attack; Team 1: Defense
44,Champions Tour 2023: Pacific League,2023,2023-04-09 05:00:00,ZETA DIVISION,Global Esports,Bo3,GE ban Fracture; ZETA ban Split; GE pick Pearl; ZETA pick Ascent; GE ban Icebox; ZETA ban Lotus; Haven remains,Pearl: 9-13; Ascent: 14-12; Haven: 13-8,"Team 1: 3 / 6, Team 2: 9 / 4; Team 1: 5 / 7 / 2, Team 2: 7 / 5 / 0; Team 1: 5 / 8, Team 2: 4 / 4",Team 1: Attack; Team 2: Defense
45,Champions Tour 2023: Pacific League,2023,2023-04-09 08:45:00,Talon Esports,DRX,Bo3,TLN ban Haven; DRX ban Lotus; TLN pick Split; DRX pick Pearl; TLN ban Fracture; DRX ban Icebox; Ascent remains,Split: 3-13; Pearl: 10-13,"Team 1: 1 / 2, Team 2: 11 / 2; Team 1: 5 / 5, Team 2: 7 / 6",Team 2: Defense; Team 1: Attack
46,Champions Tour 2023: Pacific League,2023,2023-04-10 05:00:00,Team Secret,Gen.G,Bo3,GEN ban Icebox; TS ban Pearl; GEN pick Haven; TS pick Fracture; GEN ban Ascent; TS ban Split; Lotus remains,Haven: 8-13; Fracture: 11-13,"Team 1: 3 / 5, Team 2: 6 / 7; Team 1: 5 / 6, Team 2: 7 / 6",Team 1: Defense; Team 2: Attack
47,Champions Tour 2023: Pacific League,2023,2023-04-15 05:00:00,Paper Rex,DRX,Bo3,DRX ban Lotus; PRX ban Haven; DRX pick Ascent; PRX pick Split; DRX ban Pearl; PRX ban Icebox; Fracture remains,Ascent: 5-13; Split: 10-13,"Team 1: 2 / 3, Team 2: 4 / 9; Team 1: 5 / 5, Team 2: 7 / 6",Team 1: Defense; Team 2: Defense
48,Champions Tour 2023: Pacific League,2023,2023-04-15 07:40:00,Team Secret,Rex Regum Qeon,Bo3,TS ban Pearl; RRQ ban Lotus; TS pick Icebox; RRQ pick Split; TS ban Ascent; RRQ ban Fracture; Haven remains,Icebox: 10-13; Split: 7-13,"Team 1: 5 / 5, Team 2: 7 / 6; Team 1: 5 / 2, Team 2: 3 / 10",Team 2: Defense; Team 1: Defense
49,Champions Tour 2023: Pacific League,2023,2023-04-16 05:00:00,T1,Gen.G,Bo3,T1 ban Pearl; GEN ban Icebox; T1 pick Ascent; GEN pick Haven; T1 ban Split; GEN ban Fracture; Lotus remains,Ascent: 5-13; Haven: 5-13,"Team 1: 3 / 2, Team 2: 9 / 4; Team 1: 0 / 5, Team 2: 6 / 7",Team 2: Defense; Team 1: Defense
50,Champions Tour 2023: Pacific League,2023,2023-04-16 07:15:00,ZETA DIVISION,DetonatioN FocusMe,Bo3,ZETA ban Lotus; DFM ban Split; ZETA pick Ascent; DFM pick Haven; ZETA ban Fracture; DFM ban Icebox; ZETA ban Pearl,Ascent: 13-9; Haven: 13-5,"Team 1: 10 / 3, Team 2: 2 / 7; Team 1: 9 / 4, Team 2: 3 / 2",Team 2: Defense; Team 1: Attack
51,Champions Tour 2023: Pacific League,2023,2023-04-17 05:00:00,Talon Esports,Global Esports,Bo3,GE ban Fracture; TLN ban Pearl; GE pick Split; TLN pick Icebox; GE ban Ascent; TLN ban Lotus; Haven remains,Split: 6-13; Icebox: 11-13,"Team 1: 3 / 3, Team 2: 9 / 4; Team 1: 6 / 5, Team 2: 6 / 7",Team 1: Attack; Team 2: Defense
52,Champions Tour 2023: Pacific League,2023,2023-04-22 04:00:00,Paper Rex,Global Esports,Bo3,PRX ban Haven; GE ban Fracture; PRX pick Icebox; GE pick Split; PRX ban Ascent; GE ban Lotus; Pearl remains,Icebox: 7-13; Split: 13-6; Pearl: 13-7,"Team 1: 6 / 1, Team 2: 6 / 7; Team 1: 9 / 4, Team 2: 3 / 3; Team 1: 8 / 5, Team 2: 4 / 3",Team 2: Defense; Team 1: Attack
53,Champions Tour 2023: Pacific League,2023,2023-04-22 07:30:00,Gen.G,DRX,Bo3,GEN ban Icebox; DRX ban Lotus; GEN pick Haven; DRX pick Fracture; GEN ban Ascent; DRX ban Split; Pearl remains,Haven: 7-13; Fracture: 13-10; Pearl: 4-13,"Team 1: 6 / 1, Team 2: 2 / 11; Team 1: 6 / 7, Team 2: 6 / 4; Team 1: 3 / 1, Team 2: 9 / 4",Team 2: Attack; Team 1: Attack
54,Champions Tour 2023: Pacific League,2023,2023-04-23 04:00:00,T1,Rex Regum Qeon,Bo3,RRQ ban Lotus; T1 ban Split; RRQ pick Haven; T1 pick Fracture; RRQ ban Icebox; T1 ban Ascent; Pearl remains,Haven: 13-9; Fracture: 13-4,"Team 1: 7 / 6, Team 2: 5 / 4; Team 1: 9 / 4, Team 2: 3 / 1",Team 1: Attack; Team 2: Defense
55,Champions Tour 2023: Pacific League,2023,2023-04-23 06:20:00,Team Secret,DetonatioN FocusMe,Bo3,DFM ban Icebox; TS ban Lotus; DFM pick Ascent; TS pick Haven; DFM ban Split; TS ban Pearl; Fracture remains,Ascent: 13-11; Haven: 13-8,"Team 1: 6 / 7, Team 2: 6 / 5; Team 1: 4 / 9, Team 2: 5 / 3",Team 1: Attack; Team 2: Attack
56,Champions Tour 2023: Pacific League,2023,2023-04-24 06:00:00,ZETA DIVISION,Talon Esports,Bo3,TLN ban Lotus; ZETA ban Icebox; TLN pick Haven; ZETA pick Ascent; TLN ban Fracture; ZETA ban Pearl; Split remains,Haven: 8-13; Ascent: 14-16,"Team 1: 4 / 4, Team 2: 8 / 5; Team 1: 6 / 6 / 2, Team 2: 6 / 6 / 4",Team 1: Attack; Team 2: Attack
57,Champions Tour 2023: Pacific League,2023,2023-04-29 04:00:00,T1,DetonatioN FocusMe,Bo3,T1 ban Haven; DFM ban Bind; T1 pick Lotus; DFM pick Split; T1 ban Ascent; DFM ban Pearl; Fracture remains,Lotus: 13-9; Split: 9-13; Fracture: 13-10,"Team 1: 6 / 7, Team 2: 4 / 5; Team 1: 4 / 5, Team 2: 6 / 7; Team 1: 6 / 7, Team 2: 6 / 4",Team 2: Attack; Team 1: Defense
58,Champions Tour 2023: Pacific League,2023,2023-04-29 08:00:00,ZETA DIVISION,Team Secret,Bo3,ZETA ban Haven; TS ban Pearl; ZETA pick Split; TS pick Lotus; ZETA ban Ascent; TS ban Bind; Fracture remains,Split: 13-9; Lotus: 10-13; Fracture: 13-9,"Team 1: 8 / 5, Team 2: 4 / 5; Team 1: 6 / 4, Team 2: 6 / 7; Team 1: 7 / 6, Team 2: 5 / 4",Team 2: Defense; Team 1: Attack
59,Champions Tour 2023: Pacific League,2023,2023-04-30 04:00:00,Global Esports,Gen.G,Bo3,GE ban Fracture; GEN ban Split; GE pick Pearl; GEN pick Lotus; GE ban Ascent; GEN ban Bind; Haven remains,Pearl: 13-8; Lotus: 13-8,"Team 1: 8 / 5, Team 2: 1 / 7; Team 1: 7 / 6, Team 2: 5 / 3",Team 2: Attack; Team 1: Attack
60,Champions Tour 2023: Pacific League,2023,2023-04-30 06:20:00,Rex Regum Qeon,DRX,Bo3,DRX ban Lotus; RRQ ban Bind; DRX pick Haven; RRQ pick Split; DRX ban Fracture; RRQ ban Ascent; Pearl remains,Haven: 13-8; Split: 10-13; Pearl: 2-13,"Team 1: 6 / 7, Team 2: 6 / 2; Team 1: 6 / 4, Team 2: 6 / 7; Team 1: 0 / 2, Team 2: 3 / 10",Team 1: Attack; Team 2: Defense
61,Champions Tour 2023: Pacific League,2023,2023-05-01 06:00:00,Talon Esports,Paper Rex,Bo3,TLN ban Bind; PRX ban Haven; TLN pick Pearl; PRX pick Split; TLN ban Ascent; PRX ban Lotus; Fracture remains,Pearl: 13-11; Split: 4-13; Fracture: 10-13,"Team 1: 9 / 4, Team 2: 3 / 8; Team 1: 3 / 1, Team 2: 9 / 4; Team 1: 6 / 4, Team 2: 6 / 7",Team 2: Attack; Team 1: Attack
62,Champions Tour 2023: Pacific League,2023,2023-05-06 04:00:00,Talon Esports,Gen.G,Bo3,GEN ban Pearl; TLN ban Split; GEN pick Fracture; TLN pick Lotus; GEN ban Bind; TLN ban Ascent; Haven remains,Fracture: 13-8; Lotus: 13-7,"Team 1: 7 / 6, Team 2: 5 / 3; Team 1: 6 / 7, Team 2: 2 / 5",Team 1: Attack; Team 2: Attack
63,Champions Tour 2023: Pacific League,2023,2023-05-06 06:30:00,ZETA DIVISION,Paper Rex,Bo3,PRX ban Haven; ZETA ban Pearl; PRX pick Split; ZETA pick Ascent; PRX ban Fracture; ZETA ban Bind; Lotus remains,Split: 6-13; Ascent: 10-13,"Team 1: 1 / 5, Team 2: 6 / 7; Team 1: 6 / 4, Team 2: 5 / 8",Team 1: Defense; Team 2: Attack
64,Champions Tour 2023: Pacific League,2023,2023-05-07 04:00:00,Rex Regum Qeon,Global Esports,Bo3,RRQ ban Lotus; GE ban Haven; RRQ pick Fracture; GE pick Pearl; RRQ ban Split; GE ban Ascent; Bind remains,Fracture: 13-10; Pearl: 13-11,"Team 1: 7 / 6, Team 2: 4 / 6; Team 1: 8 / 5, Team 2: 4 / 7",Team 2: Attack; Team 1: Attack
65,Champions Tour 2023: Pacific League,2023,2023-05-07 07:00:00,Team Secret,T1,Bo3,TS ban Pearl; T1 ban Haven; TS pick Lotus; T1 pick Bind; TS ban Ascent; T1 ban Split; Fracture remains,Lotus: 4-13; Bind: 8-13,"Team 1: 2 / 2, Team 2: 10 / 3; Team 1: 3 / 5, Team 2: 6 / 7",Team 2: Defense; Team 1: Defense
66,Champions Tour 2023: Pacific League,2023,2023-05-08 06:00:00,DRX,DetonatioN FocusMe,Bo3,DFM ban Haven; DRX ban Lotus; DFM pick Fracture; DRX pick Ascent; DFM ban Split; DRX ban Bind; Pearl remains,Fracture: 13-8; Ascent: 13-4,"Team 1: 5 / 8, Team 2: 7 / 1; Team 1: 9 / 4, Team 2: 3 / 1",Team 1: Attack; Team 2: Defense
67,Champions Tour 2023: Pacific League,2023,2023-05-12 04:00:00,Paper Rex,Gen.G,Bo3,PRX ban Haven; GEN ban Pearl; PRX pick Split; GEN pick Ascent; PRX ban Fracture; GEN ban Bind; Lotus remains,Split: 13-7; Ascent: 13-2,"Team 1: 9 / 4, Team 2: 3 / 4; Team 1: 10 / 3, Team 2: 2 / 0",Team 2: Defense; Team 1: Attack
68,Champions Tour 2023: Pacific League,2023,2023-05-12 07:45:00,ZETA DIVISION,T1,Bo3,ZETA ban Pearl; T1 ban Split; ZETA pick Fracture; T1 pick Lotus; ZETA ban Ascent; T1 ban Haven; Bind remains,Fracture: 11-13; Lotus: 13-10; Bind: 3-13,"Team 1: 6 / 5, Team 2: 6 / 7; Team 1: 3 / 10, Team 2: 9 / 1; Team 1: 3 / 0, Team 2: 9 / 4",Team 2: Defense; Team 1: Attack
69,Champions Tour 2023: Pacific League,2023,2023-05-13 04:00:00,Team Secret,DRX,Bo3,TS ban Pearl; DRX ban Lotus; TS pick Haven; DRX pick Ascent; TS ban Split; DRX ban Bind; Fracture remains,Haven: 13-8; Ascent: 13-11,"Team 1: 5 / 8, Team 2: 4 / 4; Team 1: 10 / 3, Team 2: 2 / 9",Team 2: Attack; Team 1: Defense
70,Champions Tour 2023: Pacific League,2023,2023-05-13 06:30:00,Global Esports,DetonatioN FocusMe,Bo3,DFM ban Haven; GE ban Fracture; DFM pick Lotus; GE pick Pearl; DFM ban Ascent; GE ban Split; Bind remains,Lotus: 13-7; Pearl: 13-6,"Team 1: 8 / 5, Team 2: 4 / 3; Team 1: 11 / 2, Team 2: 1 / 5",Team 1: Attack; Team 2: Defense
71,Champions Tour 2023: Pacific League,2023,2023-05-14 04:00:00,Talon Esports,Rex Regum Qeon,Bo3,RRQ ban Lotus; TLN ban Fracture; RRQ pick Split; TLN pick Ascent; RRQ ban Pearl; TLN ban Bind; Haven remains,Split: 13-3; Ascent: 4-13; Haven: 7-13,"Team 1: 9 / 4, Team 2: 3 / 0; Team 1: 1 / 3, Team 2: 4 / 9; Team 1: 4 / 3, Team 2: 8 / 5",Team 1: Attack; Team 2: Attack
72,Champions Tour 2023: Pacific League,2023,2023-05-14 07:00:00,ZETA DIVISION,Gen.G,Bo3,GEN ban Pearl; ZETA ban Bind; GEN pick Haven; ZETA pick Ascent; GEN ban Lotus; ZETA ban Split; Fracture remains,Haven: 13-8; Ascent: 4-13; Fracture: 13-4,"Team 1: 8 / 5, Team 2: 4 / 4; Team 1: 1 / 3, Team 2: 4 / 9; Team 1: 5 / 8, Team 2: 0 / 4",Team 1: Attack; Team 2: Attack
73,Champions Tour 2023: Pacific League,2023,2023-05-15 04:00:00,T1,DRX,Bo3,T1 ban Split; DRX ban Lotus; T1 pick Bind; DRX pick Pearl; T1 ban Haven; DRX ban Fracture; Ascent remains,Bind: 10-13; Pearl: 9-13,"Team 1: 7 / 3, Team 2: 4 / 9; Team 1: 3 / 6, Team 2: 9 / 4",Team 2: Attack; Team 1: Attack
74,Champions Tour 2023: Pacific League,2023,2023-05-15 07:00:00,Team Secret,Global Esports,Bo3,TS ban Pearl; GE ban Fracture; TS pick Haven; GE pick Lotus; TS ban Split; GE ban Ascent; Bind remains,Haven: 13-9; Lotus: 13-10,"Team 1: 7 / 6, Team 2: 3 / 6; Team 1: 7 / 6, Team 2: 5 / 5",Team 2: Attack; Team 1: Attack
75,Champions Tour 2023: Pacific League,2023,2023-05-16 04:00:00,Talon Esports,DetonatioN FocusMe,Bo3,TLN ban Ascent; DFM ban Haven; TLN pick Lotus; DFM pick Bind; TLN ban Split; DFM ban Pearl; Fracture remains,Lotus: 13-11; Bind: 13-4,"Team 1: 7 / 6, Team 2: 5 / 6; Team 1: 10 / 3, Team 2: 2 / 2",Team 2: Attack; Team 1: Attack
